[
  {
    "@context": {
      "dc": "http://purl.org/dc/elements/1.1/",
      "dcterms": "http://purl.org/dc/terms/",
      "schema": "http://schema.org/",
      "bibo": "http://purl.org/ontology/bibo/",
      "foaf": "http://xmlns.com/foaf/0.1/",
      "skos": "http://www.w3.org/2004/02/skos/core#",
      "prism": "http://prismstandard.org/namespaces/basic/2.0/",
      "isiscb": "https://ontology.isiscb.org/vocabulary/",
      "schema:name": {
        "@id": "dc:title"
      },
      "isiscb:title": {
        "@id": "dc:title"
      },
      "schema:author": {
        "@id": "dc:creator"
      },
      "isiscb:author": {
        "@id": "dc:creator"
      },
      "schema:datePublished": {
        "@id": "dc:date"
      },
      "isiscb:publicationDate": {
        "@id": "dc:date"
      },
      "schema:publisher": {
        "@id": "dc:publisher"
      },
      "schema:about": {
        "@id": "dc:subject"
      },
      "schema:inLanguage": {
        "@id": "dc:language"
      },
      "schema:identifier": {
        "@id": "dc:identifier"
      }
    },
    "@id": "https://data.isiscb.org/citation/CBB262293571",
    "isiscb:recordID": "CBB262293571",
    "@type": [
      "bibo:Article",
      "schema:ScholarlyArticle",
      "isiscb:Article"
    ],
    "isiscb:recordStatus": "isiscb:statusActive",
    "isiscb:recordNatureOriginal": "Active (RecordStatusExplanation Inactive by default)",
    "dc:title": "Love Is a Problem of Knowledge"
  },
  {
    "@context": {
      "dc": "http://purl.org/dc/elements/1.1/",
      "dcterms": "http://purl.org/dc/terms/",
      "schema": "http://schema.org/",
      "bibo": "http://purl.org/ontology/bibo/",
      "foaf": "http://xmlns.com/foaf/0.1/",
      "skos": "http://www.w3.org/2004/02/skos/core#",
      "prism": "http://prismstandard.org/namespaces/basic/2.0/",
      "isiscb": "https://ontology.isiscb.org/vocabulary/",
      "schema:name": {
        "@id": "dc:title"
      },
      "isiscb:title": {
        "@id": "dc:title"
      },
      "schema:author": {
        "@id": "dc:creator"
      },
      "isiscb:author": {
        "@id": "dc:creator"
      },
      "schema:datePublished": {
        "@id": "dc:date"
      },
      "isiscb:publicationDate": {
        "@id": "dc:date"
      },
      "schema:publisher": {
        "@id": "dc:publisher"
      },
      "schema:about": {
        "@id": "dc:subject"
      },
      "schema:inLanguage": {
        "@id": "dc:language"
      },
      "schema:identifier": {
        "@id": "dc:identifier"
      }
    },
    "@id": "https://data.isiscb.org/citation/CBB550080731",
    "isiscb:recordID": "CBB550080731",
    "@type": [
      "bibo:Article",
      "schema:ScholarlyArticle",
      "isiscb:Article"
    ],
    "isiscb:recordStatus": "isiscb:statusActive",
    "isiscb:recordNatureOriginal": "Active (RecordStatusExplanation Inactive by default)",
    "dc:title": "The Triumph of Theriac: Print, Apothecary Publications, and the Commodification of Ancient Antidotes (1497–1800)"
  },
  {
    "@context": {
      "dc": "http://purl.org/dc/elements/1.1/",
      "dcterms": "http://purl.org/dc/terms/",
      "schema": "http://schema.org/",
      "bibo": "http://purl.org/ontology/bibo/",
      "foaf": "http://xmlns.com/foaf/0.1/",
      "skos": "http://www.w3.org/2004/02/skos/core#",
      "prism": "http://prismstandard.org/namespaces/basic/2.0/",
      "isiscb": "https://ontology.isiscb.org/vocabulary/",
      "schema:name": {
        "@id": "dc:title"
      },
      "isiscb:title": {
        "@id": "dc:title"
      },
      "schema:author": {
        "@id": "dc:creator"
      },
      "isiscb:author": {
        "@id": "dc:creator"
      },
      "schema:datePublished": {
        "@id": "dc:date"
      },
      "isiscb:publicationDate": {
        "@id": "dc:date"
      },
      "schema:publisher": {
        "@id": "dc:publisher"
      },
      "schema:about": {
        "@id": "dc:subject"
      },
      "schema:inLanguage": {
        "@id": "dc:language"
      },
      "schema:identifier": {
        "@id": "dc:identifier"
      }
    },
    "@id": "https://data.isiscb.org/citation/CBB317984823",
    "isiscb:recordID": "CBB317984823",
    "@type": [
      "bibo:Article",
      "schema:ScholarlyArticle",
      "isiscb:Article"
    ],
    "isiscb:recordStatus": "isiscb:statusActive",
    "isiscb:recordNatureOriginal": "Active (RecordStatusExplanation Inactive by default)",
    "dc:title": "Galileo’s Two New Sciences as a Model of Reading Practice"
  },
  {
    "@context": {
      "dc": "http://purl.org/dc/elements/1.1/",
      "dcterms": "http://purl.org/dc/terms/",
      "schema": "http://schema.org/",
      "bibo": "http://purl.org/ontology/bibo/",
      "foaf": "http://xmlns.com/foaf/0.1/",
      "skos": "http://www.w3.org/2004/02/skos/core#",
      "prism": "http://prismstandard.org/namespaces/basic/2.0/",
      "isiscb": "https://ontology.isiscb.org/vocabulary/",
      "schema:name": {
        "@id": "dc:title"
      },
      "isiscb:title": {
        "@id": "dc:title"
      },
      "schema:author": {
        "@id": "dc:creator"
      },
      "isiscb:author": {
        "@id": "dc:creator"
      },
      "schema:datePublished": {
        "@id": "dc:date"
      },
      "isiscb:publicationDate": {
        "@id": "dc:date"
      },
      "schema:publisher": {
        "@id": "dc:publisher"
      },
      "schema:about": {
        "@id": "dc:subject"
      },
      "schema:inLanguage": {
        "@id": "dc:language"
      },
      "schema:identifier": {
        "@id": "dc:identifier"
      }
    },
    "@id": "https://data.isiscb.org/citation/CBB123318800",
    "isiscb:recordID": "CBB123318800",
    "@type": [
      "bibo:Article",
      "schema:ScholarlyArticle",
      "isiscb:Article"
    ],
    "isiscb:recordStatus": "isiscb:statusActive",
    "isiscb:recordNatureOriginal": "Active (RecordStatusExplanation )",
    "dc:title": "Frontier of Professionals:The Vision of American Advisors That Supported Hokkaido Development in the Early Meiji Period"
  },
  {
    "@context": {
      "dc": "http://purl.org/dc/elements/1.1/",
      "dcterms": "http://purl.org/dc/terms/",
      "schema": "http://schema.org/",
      "bibo": "http://purl.org/ontology/bibo/",
      "foaf": "http://xmlns.com/foaf/0.1/",
      "skos": "http://www.w3.org/2004/02/skos/core#",
      "prism": "http://prismstandard.org/namespaces/basic/2.0/",
      "isiscb": "https://ontology.isiscb.org/vocabulary/",
      "schema:name": {
        "@id": "dc:title"
      },
      "isiscb:title": {
        "@id": "dc:title"
      },
      "schema:author": {
        "@id": "dc:creator"
      },
      "isiscb:author": {
        "@id": "dc:creator"
      },
      "schema:datePublished": {
        "@id": "dc:date"
      },
      "isiscb:publicationDate": {
        "@id": "dc:date"
      },
      "schema:publisher": {
        "@id": "dc:publisher"
      },
      "schema:about": {
        "@id": "dc:subject"
      },
      "schema:inLanguage": {
        "@id": "dc:language"
      },
      "schema:identifier": {
        "@id": "dc:identifier"
      }
    },
    "@id": "https://data.isiscb.org/citation/CBB234311668",
    "isiscb:recordID": "CBB234311668",
    "@type": [
      "bibo:Article",
      "schema:ScholarlyArticle",
      "isiscb:Article"
    ],
    "isiscb:recordStatus": "isiscb:statusActive",
    "isiscb:recordNatureOriginal": "Active (RecordStatusExplanation Inactive by default)",
    "dc:title": "Defects in Doubt Manufacturing: The Trajectory of a Pro-industrial Argument in the Struggle for the Definition of Carcinogenic Substances"
  },
  {
    "@context": {
      "dc": "http://purl.org/dc/elements/1.1/",
      "dcterms": "http://purl.org/dc/terms/",
      "schema": "http://schema.org/",
      "bibo": "http://purl.org/ontology/bibo/",
      "foaf": "http://xmlns.com/foaf/0.1/",
      "skos": "http://www.w3.org/2004/02/skos/core#",
      "prism": "http://prismstandard.org/namespaces/basic/2.0/",
      "isiscb": "https://ontology.isiscb.org/vocabulary/",
      "schema:name": {
        "@id": "dc:title"
      },
      "isiscb:title": {
        "@id": "dc:title"
      },
      "schema:author": {
        "@id": "dc:creator"
      },
      "isiscb:author": {
        "@id": "dc:creator"
      },
      "schema:datePublished": {
        "@id": "dc:date"
      },
      "isiscb:publicationDate": {
        "@id": "dc:date"
      },
      "schema:publisher": {
        "@id": "dc:publisher"
      },
      "schema:about": {
        "@id": "dc:subject"
      },
      "schema:inLanguage": {
        "@id": "dc:language"
      },
      "schema:identifier": {
        "@id": "dc:identifier"
      }
    },
    "@id": "https://data.isiscb.org/citation/CBB704973598",
    "isiscb:recordID": "CBB704973598",
    "@type": [
      "bibo:Article",
      "schema:ScholarlyArticle",
      "isiscb:Article"
    ],
    "isiscb:recordStatus": "isiscb:statusActive",
    "isiscb:recordNatureOriginal": "Active (RecordStatusExplanation Inactive by default)",
    "dc:title": "Economizing Socialist Aid: China's Failed Surgical Plant in Algeria, 1973–80"
  },
  {
    "@context": {
      "dc": "http://purl.org/dc/elements/1.1/",
      "dcterms": "http://purl.org/dc/terms/",
      "schema": "http://schema.org/",
      "bibo": "http://purl.org/ontology/bibo/",
      "foaf": "http://xmlns.com/foaf/0.1/",
      "skos": "http://www.w3.org/2004/02/skos/core#",
      "prism": "http://prismstandard.org/namespaces/basic/2.0/",
      "isiscb": "https://ontology.isiscb.org/vocabulary/",
      "schema:name": {
        "@id": "dc:title"
      },
      "isiscb:title": {
        "@id": "dc:title"
      },
      "schema:author": {
        "@id": "dc:creator"
      },
      "isiscb:author": {
        "@id": "dc:creator"
      },
      "schema:datePublished": {
        "@id": "dc:date"
      },
      "isiscb:publicationDate": {
        "@id": "dc:date"
      },
      "schema:publisher": {
        "@id": "dc:publisher"
      },